{
  "schemaVersion": "1.0",
  "id": "beispiel-station-a",
  "type": "text-analyse",
  "status": "entwurf",
  "title": "[TODO: Titel der Station A]",
  "instructions": "[TODO: Anweisungen für den Lernenden]",
  "content": {
    "placeholder": "[TODO: Inhalt je nach Stationstyp einfügen]"
  },
  "citations": [
    {
      "sourceId": "osborne-hermeneutical-spiral",
      "pages": "[TODO: Seitenangabe]",
      "function": "[TODO: begründend/weiterführend/etc.]"
    }
  ]
}
